{
  "scene": "opening_cover",
  "name": "楼板/屋面洞口防护",
  "version": "1.0.0",
  "source_versions": {
    "jgj-80-2016": "JGJ 80-2016",
    "mohurd-2019-90": "建办质函〔2019〕90号"
  },
  "keywords": ["洞口防护", "楼板洞口", "屋面洞口", "管井", "设备井", "采光井", "天窗", "洞口盖板", "盖板"],
  "applicable_conditions": [
    "非竖向楼板、屋面等洞口的临时防坠落防护",
    "按洞口短边尺寸分级；电梯井口属于独立场景，不适用本卡"
  ],
  "required_components": [
    "洞口轮廓与短边/长边尺寸",
    "25mm～500mm 洞口使用承载力满足要求且固定牢固的盖板",
    "500mm～1500mm 洞口采用固定盖板或防护栏杆",
    "短边≥1500mm 洞口采用高度不小于1.2m的防护栏杆并以安全平网封闭"
  ],
  "dimension_rules": [
    { "field": "opening_short_side", "rule": "短边25mm～500mm时采用盖板；500mm～1500mm时采用盖板或防护栏杆；≥1500mm时采用防护栏杆并以安全平网封闭", "min_mm": 25 },
    { "field": "opening_long_side", "rule": "长边应不小于短边，作为洞口尺寸记录", "min_mm": 25 },
    { "field": "guardrail_height", "rule": "短边≥1500mm时防护栏杆高度不小于1.2m", "min_mm": 1200 },
    { "field": "cover_fixed", "rule": "采用盖板时应固定牢固；盖板承载力须满足使用要求" }
  ],
  "forbidden_items": [
    "不得将楼板/屋面洞口盖板路由为电梯井口防护门",
    "不得在短边≥1500mm时只画盖板而省略防护栏杆和安全平网",
    "不得在短边25mm～500mm时省略盖板固定条件",
    "短边小于25mm或尺寸不完整时不得自动给出合规结论"
  ],
  "material_table_rules": [
    "盖板方案至少记录盖板、固定件和承载力复核",
    "大洞口方案至少记录防护栏杆和安全平网"
  ],
  "drawing_conventions": [
    "用户未指定绘图位置时，洞口中心默认取 x=0, y=0",
    "平面图表达洞口轮廓、盖板/栏杆/安全平网方案和尺寸标注"
  ],
  "citations": [
    {
      "source_id": "jgj-80-2016",
      "excerpt_id": "jgj-80-2016-4.2.1",
      "section": "4.2.1 洞口作业",
      "page": 13
    },
    {
      "source_id": "mohurd-2019-90",
      "excerpt_id": "mohurd-2019-90-2.7.1",
      "section": "2.7.1 洞口防护（短边尺寸≤1500mm）",
      "page": 117
    }
  ]
}
