{
  "scene": "edge_guardrail",
  "name": "普通临边防护栏杆",
  "version": "1.1.0",
  "source_versions": {
    "jgj-80-2016": "JGJ 80-2016",
    "mohurd-2019-90": "建办质函〔2019〕90号"
  },
  "keywords": ["临边", "楼层边", "阳台边", "屋面边", "基坑边", "防护栏杆", "护栏"],
  "applicable_conditions": [
    "基坑边、楼层边、阳台边、屋面边等存在坠落风险的普通临边作业部位",
    "适用于采用钢管、扣件式防护栏杆的通用临边防护",
    "与室内电梯井口防护门、短边洞口盖板等场景区分，不得互相替代"
  ],
  "required_components": [
    "两道横杆：上杆 + 下杆",
    "立杆",
    "挡脚板（踢脚板）",
    "内侧密目安全网（标准化图册做法）"
  ],
  "dimension_rules": [
    { "field": "top_rail_height", "rule": "防护栏杆上杆距地面高度应为 1.2m", "value_mm": 1200 },
    { "field": "mid_rail", "rule": "下杆应在上杆和挡脚板中间设置" },
    { "field": "post_spacing", "rule": "防护栏杆立杆间距不应大于 2m", "max_mm": 2000 },
    { "field": "toe_board_height", "rule": "挡脚板高度不应小于 180mm", "min_mm": 180 }
  ],
  "forbidden_items": [
    "不得将临边防护栏杆规则套用于室内电梯井口防护门",
    "不得将电梯井口防护门工具误用于普通楼层临边、屋面临边、阳台临边或基坑边",
    "缺少临边长度、转角、端部收口、作业侧等现场信息时，不得编造布置"
  ],
  "material_table_rules": [
    "材料表至少区分横杆、立杆、挡脚板、密目安全网和连接扣件",
    "自动出图工具未实现前，只能输出参数清单和做法边界，不得声称已完成确定性 CAD 校核"
  ],
  "drawing_conventions": [
    "普通临边防护应按边线长度、转角、端部收口和作业侧确定栏杆布置",
    "当前版本尚未开放 edge_guardrail 的确定性绘图工具，不得调用电梯井口防护门工具替代"
  ],
  "citations": [
    {
      "source_id": "jgj-80-2016",
      "excerpt_id": "jgj-80-2016-4.3.1",
      "section": "4.3.1 防护栏杆",
      "page": 14
    },
    {
      "source_id": "mohurd-2019-90",
      "excerpt_id": "mohurd-2019-90-2.7.2",
      "section": "2.7.2 临边防护（2.7.2.1 钢管、扣件式防护）",
      "page": 120
    }
  ]
}
