{
  "scene": "elevator_shaft_protection",
  "name": "室内电梯井口防护",
  "version": "1.2.0",
  "source_versions": {
    "jgj-80-2016": "JGJ 80-2016",
    "mohurd-2019-90": "建办质函〔2019〕90号"
  },
  "keywords": ["电梯井", "电梯井口", "井口防护", "电梯井防护", "防护门", "室内电梯井"],
  "applicable_conditions": [
    "施工阶段室内电梯井口，在正式井道门安装前的防护部位",
    "楼层平面内电梯井口周边存在人员通行、作业或物料坠落风险",
    "电梯井口属竖向洞口，与「洞口防护（短边≤1500mm）」「临边防护栏杆」为不同场景，须采用定型化防护门"
  ],
  "required_components": [
    "防护门（定型化、工具式，可上翻式或三件套式）—— JGJ 80-2016 4.2.2 强制性条文",
    "防护门高度不小于 1.5m（1500mm）",
    "防护门底端距地面高度不大于 50mm",
    "挡脚板（踢脚板）",
    "上口两端 Φ16 钢筋翻转轴（上翻式）",
    "水平杆 + L型卡固件（三件套式，卡固于井道内侧）",
    "外侧警示牌「当心坠落 严禁抛物」"
  ],
  "dimension_rules": [
    { "field": "guard_height", "rule": "防护门高度不应小于 1.5m（1500mm），强制性条文", "min_mm": 1500 },
    { "field": "door_bottom_gap", "rule": "防护门底端距地面高度不应大于 50mm，强制性条文", "max_mm": 50 },
    { "field": "guard_width", "rule": "防护门宽度为 1.5m 和 2.1m 两种规格，根据井口尺寸选定", "options_m": [1.5, 2.1] },
    { "field": "toe_board_height", "rule": "防护门底部安装挡脚板（指导图册给 200mm 高踢脚板）", "value_mm": 200 },
    { "field": "hinge", "rule": "防护门上口两端设置 Φ16 钢筋作为翻转轴，使门上下翻转（上翻式）" },
    { "field": "fixing", "rule": "三件套式：防护门 + 水平杆 + L型卡固件，卡固件向外滑移卡固于井道内侧" }
  ],
  "forbidden_items": [
    "不得用「临边防护栏杆」（上杆1.2m、立杆间距≤2m、挡脚板≥180mm）替代电梯井口防护门——那是 2.7.2/4.3.1 临边防护的做法，场景不同",
    "防护门高度不得低于 1.5m（JGJ 80-2016 4.2.2 强制性条文）",
    "防护门底端距地面高度不得大于 50mm（JGJ 80-2016 4.2.2 强制性条文）",
    "不得省略挡脚板",
    "不得省略外侧「当心坠落 严禁抛物」警示牌",
    "装饰施工阶段可临时拆除，但抹灰完成后必须重新安装恢复",
    "不得在缺少井口尺寸时自行编造宽度规格"
  ],
  "material_table_rules": [
    "防护门按井口宽度从 1.5m / 2.1m 两种规格中选型",
    "挡脚板（踢脚板）高 200mm",
    "警示牌至少 1 块（当心坠落 严禁抛物）"
  ],
  "drawing_conventions": [
    "用户未指定绘图位置时，井口中心默认取 x=0, y=0，不要因缺少坐标而追问或停止出图"
  ],
  "citations": [
    {
      "source_id": "jgj-80-2016",
      "excerpt_id": "jgj-80-2016-4.2.2",
      "section": "4.2.2 洞口作业（电梯井口防护）",
      "page": 14
    },
    {
      "source_id": "mohurd-2019-90",
      "excerpt_id": "mohurd-2019-90-2.7.4-a",
      "section": "2.7.4 室内电梯井口防护（一）",
      "page": 126
    },
    {
      "source_id": "mohurd-2019-90",
      "excerpt_id": "mohurd-2019-90-2.7.4-b",
      "section": "2.7.4 室内电梯井口防护（二）",
      "page": 127
    }
  ]
}
