{
  "scene": "elevator_shaft_safety_net",
  "name": "电梯井内安全平网",
  "version": "1.1.0",
  "source_versions": {
    "jgj-80-2016": "JGJ 80-2016"
  },
  "keywords": ["安全平网", "井内平网", "井道平网", "平网防护", "电梯井内", "隔离防护"],
  "applicable_conditions": [
    "电梯施工前，电梯井道内的坠落防护",
    "主体/砌筑施工阶段井道内水平防护",
    "与井口防护门互补：防护门封井口，安全平网封井内，二者不互相替代"
  ],
  "required_components": [
    "安全平网（水平布置，覆盖井道截面）",
    "平网周边固定装置",
    "施工层上部隔离防护设施"
  ],
  "dimension_rules": [
    { "field": "net_spacing", "rule": "每隔2层且不大于10m加设一道安全平网", "max_mm": 10000 },
    { "field": "net_to_wall_gap", "rule": "网体与井壁空隙不大于25mm（指导图册做法，出处待核）", "max_mm": 25 },
    { "field": "upper_isolation", "rule": "电梯井内的施工层上部设置隔离防护设施" }
  ],
  "forbidden_items": [
    "不得将井内平网参数混入防护门参数",
    "平网垂直间距超过10m或超过2层层高时不得判定合格",
    "不得用井口防护门工具替代井内平网布置"
  ],
  "material_table_rules": [
    "材料表至少区分安全平网、固定装置和上部隔离防护",
    "平网布置应标注层高、间距和网体与井壁空隙"
  ],
  "drawing_conventions": [
    "平面图表达：井道轮廓 + 平网轮廓（按空隙内缩）+ 周边固定标记",
    "标注每隔2层且不大于10m的布置规则与施工层上部隔离防护"
  ],
  "citations": [
    {
      "source_id": "jgj-80-2016",
      "excerpt_id": "jgj-80-2016-4.2.3",
      "section": "4.2.3 电梯井道内安全平网",
      "page": 14
    }
  ]
}
